{
  "schema_version": "frankenjax.parity-gate.v1",
  "packet_id": "FJ-P2C-004",
  "generated_at_unix_ms": 1739520000000,
  "strict_mode": {
    "status": "pass",
    "checked_cases": 8,
    "mismatches": 0,
    "report_path": "artifacts/evidence/FJ-P2C-004/parity_strict.json"
  },
  "hardened_mode": {
    "status": "pass",
    "checked_cases": 8,
    "allowlisted_drift_count": 1,
    "report_path": "artifacts/evidence/FJ-P2C-004/parity_hardened.json"
  },
  "gates": [
    {
      "gate_id": "G3-differential",
      "description": "Legacy oracle differential parity",
      "status": "pass",
      "evidence_refs": [
        "artifacts/evidence/FJ-P2C-004/parity_strict.json",
        "artifacts/evidence/FJ-P2C-004/parity_hardened.json"
      ]
    }
  ],
  "overall_status": "pass"
}
